{
  "version": "1.0.0",
  "status": "DISCOVERED",
  "sourceOfTruth": "contracts/entity/entity-catalog.v1.json + contracts/entity/entity-implementation-evidence.v1.json + contracts/entity/entity-field-contract.v1.json + contracts/alignment/payload-inventory.v1.json + contracts/alignment/api-inventory.v1.json + contracts/alignment/cross-system-mapping.v1.json",
  "generatedBy": "scripts/build-code-evidence-inventory.mjs",
  "records": [
    {
      "evidenceId": "API_OPERATION:applyForCreator",
      "subjectType": "API_OPERATION",
      "subjectId": "applyForCreator",
      "implementationStatus": "UNRESOLVED",
      "implementationRefs": [],
      "testRefs": [],
      "schemaEvidenceRefs": [],
      "sourceRefs": [
        "contracts/openapi/v1/openapi.yaml",
        "contracts/api/api-inventory.v1.json"
      ],
      "blockers": [
        "Runtime API implementation evidence is not yet mechanically discovered"
      ]
    },
    {
      "evidenceId": "API_OPERATION:authCredentialAdd",
      "subjectType": "API_OPERATION",
      "subjectId": "authCredentialAdd",
      "implementationStatus": "IMPLEMENTED",
      "implementationRefs": [
        "workers/W02-identity/src/credentials/credential-add.ts",
        "workers/W02-identity/src/credentials/credential-list.ts",
        "workers/W02-identity/src/credentials/credential-lifecycle.ts"
      ],
      "testRefs": [
        "workers/W02-identity/src/credentials/credential-add.test.ts"
      ],
      "schemaEvidenceRefs": [],
      "sourceRefs": [
        "contracts/openapi/v1/openapi.yaml",
        "contracts/api/api-inventory.v1.json",
        "contracts/alignment/cross-system-mapping.v1.json"
      ],
      "blockers": []
    },
    {
      "evidenceId": "API_OPERATION:authCredentialList",
      "subjectType": "API_OPERATION",
      "subjectId": "authCredentialList",
      "implementationStatus": "IMPLEMENTED",
      "implementationRefs": [
        "workers/W02-identity/src/credentials/credential-add.ts",
        "workers/W02-identity/src/credentials/credential-list.ts",
        "workers/W02-identity/src/credentials/credential-lifecycle.ts"
      ],
      "testRefs": [
        "workers/W02-identity/src/credentials/credential-add.test.ts"
      ],
      "schemaEvidenceRefs": [],
      "sourceRefs": [
        "contracts/openapi/v1/openapi.yaml",
        "contracts/api/api-inventory.v1.json",
        "contracts/alignment/cross-system-mapping.v1.json"
      ],
      "blockers": []
    },
    {
      "evidenceId": "API_OPERATION:authCredentialRemove",
      "subjectType": "API_OPERATION",
      "subjectId": "authCredentialRemove",
      "implementationStatus": "IMPLEMENTED",
      "implementationRefs": [
        "workers/W02-identity/src/credentials/credential-add.ts",
        "workers/W02-identity/src/credentials/credential-list.ts",
        "workers/W02-identity/src/credentials/credential-lifecycle.ts"
      ],
      "testRefs": [
        "workers/W02-identity/src/credentials/credential-add.test.ts"
      ],
      "schemaEvidenceRefs": [],
      "sourceRefs": [
        "contracts/openapi/v1/openapi.yaml",
        "contracts/api/api-inventory.v1.json",
        "contracts/alignment/cross-system-mapping.v1.json"
      ],
      "blockers": []
    },
    {
      "evidenceId": "API_OPERATION:authCredentialReplace",
      "subjectType": "API_OPERATION",
      "subjectId": "authCredentialReplace",
      "implementationStatus": "IMPLEMENTED",
      "implementationRefs": [
        "workers/W02-identity/src/credentials/credential-add.ts",
        "workers/W02-identity/src/credentials/credential-list.ts",
        "workers/W02-identity/src/credentials/credential-lifecycle.ts"
      ],
      "testRefs": [
        "workers/W02-identity/src/credentials/credential-add.test.ts"
      ],
      "schemaEvidenceRefs": [],
      "sourceRefs": [
        "contracts/openapi/v1/openapi.yaml",
        "contracts/api/api-inventory.v1.json",
        "contracts/alignment/cross-system-mapping.v1.json"
      ],
      "blockers": []
    },
    {
      "evidenceId": "API_OPERATION:authLogin",
      "subjectType": "API_OPERATION",
      "subjectId": "authLogin",
      "implementationStatus": "UNRESOLVED",
      "implementationRefs": [],
      "testRefs": [],
      "schemaEvidenceRefs": [],
      "sourceRefs": [
        "contracts/openapi/v1/openapi.yaml",
        "contracts/api/api-inventory.v1.json"
      ],
      "blockers": [
        "Runtime API implementation evidence is not yet mechanically discovered"
      ]
    },
    {
      "evidenceId": "API_OPERATION:authLogout",
      "subjectType": "API_OPERATION",
      "subjectId": "authLogout",
      "implementationStatus": "UNRESOLVED",
      "implementationRefs": [],
      "testRefs": [],
      "schemaEvidenceRefs": [],
      "sourceRefs": [
        "contracts/openapi/v1/openapi.yaml",
        "contracts/api/api-inventory.v1.json"
      ],
      "blockers": [
        "Runtime API implementation evidence is not yet mechanically discovered"
      ]
    },
    {
      "evidenceId": "API_OPERATION:authPasswordChange",
      "subjectType": "API_OPERATION",
      "subjectId": "authPasswordChange",
      "implementationStatus": "IMPLEMENTED",
      "implementationRefs": [
        "workers/W01-payload/src/app/auth/password/change/route.ts",
        "workers/W01-payload/src/app/auth/password/reset/request/route.ts",
        "workers/W01-payload/src/app/auth/password/reset/confirm/route.ts"
      ],
      "testRefs": [],
      "schemaEvidenceRefs": [],
      "sourceRefs": [
        "contracts/openapi/v1/openapi.yaml",
        "contracts/api/api-inventory.v1.json",
        "contracts/alignment/cross-system-mapping.v1.json"
      ],
      "blockers": []
    },
    {
      "evidenceId": "API_OPERATION:authPasswordResetConfirm",
      "subjectType": "API_OPERATION",
      "subjectId": "authPasswordResetConfirm",
      "implementationStatus": "IMPLEMENTED",
      "implementationRefs": [
        "workers/W01-payload/src/app/auth/password/change/route.ts",
        "workers/W01-payload/src/app/auth/password/reset/request/route.ts",
        "workers/W01-payload/src/app/auth/password/reset/confirm/route.ts"
      ],
      "testRefs": [],
      "schemaEvidenceRefs": [],
      "sourceRefs": [
        "contracts/openapi/v1/openapi.yaml",
        "contracts/api/api-inventory.v1.json",
        "contracts/alignment/cross-system-mapping.v1.json"
      ],
      "blockers": []
    },
    {
      "evidenceId": "API_OPERATION:authPasswordResetRequest",
      "subjectType": "API_OPERATION",
      "subjectId": "authPasswordResetRequest",
      "implementationStatus": "IMPLEMENTED",
      "implementationRefs": [
        "workers/W01-payload/src/app/auth/password/change/route.ts",
        "workers/W01-payload/src/app/auth/password/reset/request/route.ts",
        "workers/W01-payload/src/app/auth/password/reset/confirm/route.ts"
      ],
      "testRefs": [],
      "schemaEvidenceRefs": [],
      "sourceRefs": [
        "contracts/openapi/v1/openapi.yaml",
        "contracts/api/api-inventory.v1.json",
        "contracts/alignment/cross-system-mapping.v1.json"
      ],
      "blockers": []
    },
    {
      "evidenceId": "API_OPERATION:authRefresh",
      "subjectType": "API_OPERATION",
      "subjectId": "authRefresh",
      "implementationStatus": "UNRESOLVED",
      "implementationRefs": [],
      "testRefs": [],
      "schemaEvidenceRefs": [],
      "sourceRefs": [
        "contracts/openapi/v1/openapi.yaml",
        "contracts/api/api-inventory.v1.json"
      ],
      "blockers": [
        "Runtime API implementation evidence is not yet mechanically discovered"
      ]
    },
    {
      "evidenceId": "API_OPERATION:authRegister",
      "subjectType": "API_OPERATION",
      "subjectId": "authRegister",
      "implementationStatus": "IMPLEMENTED",
      "implementationRefs": [
        "workers/W01-payload/src/app/auth/register/route.ts",
        "workers/W01-payload/src/collections/Users.ts",
        "workers/W01-payload/src/payload.config.ts",
        "workers/W02-identity/src/credentials/credential-add.ts"
      ],
      "testRefs": [
        "workers/W02-identity/src/credentials/credential-add.test.ts"
      ],
      "schemaEvidenceRefs": [],
      "sourceRefs": [
        "contracts/openapi/v1/openapi.yaml",
        "contracts/api/api-inventory.v1.json",
        "contracts/alignment/cross-system-mapping.v1.json"
      ],
      "blockers": []
    },
    {
      "evidenceId": "API_OPERATION:authSessionGet",
      "subjectType": "API_OPERATION",
      "subjectId": "authSessionGet",
      "implementationStatus": "UNRESOLVED",
      "implementationRefs": [],
      "testRefs": [],
      "schemaEvidenceRefs": [],
      "sourceRefs": [
        "contracts/openapi/v1/openapi.yaml",
        "contracts/api/api-inventory.v1.json"
      ],
      "blockers": [
        "Runtime API implementation evidence is not yet mechanically discovered"
      ]
    },
    {
      "evidenceId": "API_OPERATION:authSessionList",
      "subjectType": "API_OPERATION",
      "subjectId": "authSessionList",
      "implementationStatus": "UNRESOLVED",
      "implementationRefs": [],
      "testRefs": [],
      "schemaEvidenceRefs": [],
      "sourceRefs": [
        "contracts/openapi/v1/openapi.yaml",
        "contracts/api/api-inventory.v1.json"
      ],
      "blockers": [
        "Runtime API implementation evidence is not yet mechanically discovered"
      ]
    },
    {
      "evidenceId": "API_OPERATION:authSessionRevoke",
      "subjectType": "API_OPERATION",
      "subjectId": "authSessionRevoke",
      "implementationStatus": "UNRESOLVED",
      "implementationRefs": [],
      "testRefs": [],
      "schemaEvidenceRefs": [],
      "sourceRefs": [
        "contracts/openapi/v1/openapi.yaml",
        "contracts/api/api-inventory.v1.json"
      ],
      "blockers": [
        "Runtime API implementation evidence is not yet mechanically discovered"
      ]
    },
    {